food_jar/food_jar_3,the item is a rust color the item has a reflection of light on it
presciption_medicine_bottle/presciption_medicine_bottle_2,a pill bottle with the details marked out
gauze/gauze_1,a fabric that aids in healing wounds
soda_bottle/soda_bottle_5,use for one time not reuse
lime/lime_3,this is a green lime it is round and shiny
hand_towel/hand_towel_3,a christmas themed white dish towel
lime/lime_4,this object is a greenishyellow small fruit
pliers/pliers_1,this is a pair of pliers to grip objects
soda_bottle/soda_bottle_3,this is a plastic bottle of dr pepper
lime/lime_1,a sour item that is dark green
cell_phone/cell_phone_3,a black smartphone
lemon/lemon_2,a small lemon with label on it
can_opener/can_opener_4,this is a can opener it is black with a black handle as well
can_opener/can_opener_2,this is an ugly green can opener
coffee_mug/coffee_mug_2,this appears to be a coffee mug
mouse/mouse_2,this is a black computer mouse with the usb cable attached
can_opener/can_opener_4,a manual can opener
mouse/mouse_2,a black usb mouse
picture_frame/picture_frame_1,this is a picture frame with a white background
lime/lime_1,the objects has two blue and red handles the other end has two pieces of metal in a v shape
apple/apple_4,an apple
notebook/notebook_2,this is black notebook
food_jar/food_jar_4,i see a medium sized jar of small whole pickles the pickles are not homemade
hammer/hammer_6,a black hammer with a wooden handle  the handle has a metal hook attached to it
shampoo/shampoo_4,this is a green bottle of shampoo
cell_phone/cell_phone_1,a black smartphone
medicine_bottle/medicine_bottle_5,the object is a bottle of cough syrup
allen_wrench/allen_wrench_3,a long allen wrench
potato/potato_2,a semi round object that is light brown with dark brown spots all over
fork/fork_2,it is a stainless steel object about 8 inches long with spiked tines on one end
eye_glasses/eye_glasses_4,it is a pair of reading glasses
spoon/spoon_3, arm open
measuring_tape/measuring_tape_5,a silver and black measuring tape
tissue_box/tissue_box_1,a box that holds tissue paper
banana/banana_2,a bunch of curved yellow frit grown in trees
pencil/pencil_3,this is a red mechanical pencil
lemon/lemon_4,it is a  lemon
lightbulb/lightbulb_4,there is a standard fluorescent light bulb with a rounded top
syringe/syringe_1,a syringe needle
medicine_bottle/medicine_bottle_4,a bottle of vitimans
mouse/mouse_2,it is a black usb mouse
apple/apple_1,its a fruit health for body
marker/marker_5,this is a black permanent marker
allen_wrench/allen_wrench_1,a set of allen keys in a case
mouse/mouse_3,it is a screwdriver with a black handle
measuring_tape/measuring_tape_4,a key chain for car keys
banana/banana_2,6 bananas with blue stickers
cell_phone/cell_phone_3,a black smartphone
cell_phone/cell_phone_3,this is a smartphone it is black
bowl/bowl_1,a medium sized green bowl
measuring_tape/measuring_tape_3,a pink and black tape measure
picture_frame/picture_frame_3,this is a picture frame  it is a place to put a picture to protect it behind glass as well as display it
bell_pepper/bell_pepper_1,this is a large uncut
tissue_box/tissue_box_1, but has to be peeled when peeled and cut
stapler/stapler_3,a royal blue plastic stapler
book/book_2,this is a thick textbook it has a red cover with a picture
screwdriver/screwdriver_2,this is a screwdriver with a blue handle
pliers/pliers_1,a red marker is laying horizontally with the lid pointing at me
coffee_mug/coffee_mug_3,a white coffee cup
pliers/pliers_4,this is a small pair of pliers
lime/lime_3,a side view of a small green lime
lemon/lemon_1,the object is a medium yellow lemon
pliers/pliers_2,red and blue needle nose pliers
flashlight/flashlight_2, longlasting light bulb
shampoo/shampoo_5,a bottle that contains shampoo and conditioner
shampoo/shampoo_3,this is a large basting syringe it is sharp and made mostly of plastic
potato/potato_5,a ripe yam
band_aid/band_aid_5,a box that contains bandaids
fork/fork_2,it is a metal fork
spoon/spoon_4,a silver tea spoon
presciption_medicine_bottle/presciption_medicine_bottle_2,an orange and white prescription bottle
potato/potato_5,on the turntable is a yellow apple
food_can/food_can_3,this is canned food with a tan label
potato/potato_4,a potato avegetable used in recipes and served as a part of a meal
lightbulb/lightbulb_5,this is a lightbulb it is used to light up your room by using electricity such as through a lamp
lightbulb/lightbulb_5,the object is small and appears to be made of plastic it is round at the top and tapers at the bottom
band_aid/band_aid_2,this is a box of bandages
bowl/bowl_5,a white square bowl with gold rim
cell_phone/cell_phone_1,human invention for communicating the beginning stages of the downfall of humans
water_bottle/water_bottle_2,a bottle of water
coffee_mug/coffee_mug_1,the object is a red coffee mug
eye_glasses/eye_glasses_4,a tool used to see
toothbrush/toothbrush_1,a yellowand white toothbrush
cell_phone/cell_phone_3,the object is a bar style cell phone
spoon/spoon_1, orange with a white lid and a white label
medicine_bottle/medicine_bottle_3,a small plastic bottle of asprins
pencil/pencil_4,the object is a black click pen
toothpaste/toothpaste_2,it is a box of colgate toothpaste
apple/apple_4,the object is a large red apple
picture_frame/picture_frame_1,this is a white picture frame
screwdriver/screwdriver_4,this is a shiny red apple
eye_glasses/eye_glasses_2, wax paper
pliers/pliers_1,handheld tool used to strike another object it consists of a handle to which is attached a heavy head
pliers/pliers_3,this object is a pair of pliers they have red and blue handles
medicine_bottle/medicine_bottle_3,a green dinner plate
onion/onion_4,this is a medium
stapler/stapler_5, heighth
marker/marker_5,this is a black marker called a sharpie that writes with permanent ink
shampoo/shampoo_1, mostly used for dishes
plate/plate_3,this is a red plate that is used to put food on
pliers/pliers_2,this is a red and black handled pair of needlenosed pliers
coffee_mug/coffee_mug_5,i see a white mug with a metallic rim
plate/plate_2,this is a round
medicine_bottle/medicine_bottle_2,this is a bottle of medication
bell_pepper/bell_pepper_4,the object is a red pepper
shampoo/shampoo_1,the object is a large white shampoo bottle with blue top
shampoo/shampoo_5,a blue plastic container
onion/onion_2,this is a yellow onion with a sticker on it
fork/fork_3,a full size silver fork
measuring_tape/measuring_tape_4,a tape measure used to measure things
measuring_tape/measuring_tape_4,i see a keychain item
stapler/stapler_4,this is a grey and black desk stapler
book/book_3,this is a rather large book it is for opencv 3 blueprints
plate/plate_3, whole
pliers/pliers_2,this is a pair of needlenosed pliers
potato/potato_2,this is a potato
shampoo/shampoo_2, green sphere that looks like a lime with a small lump on the front side and a sticker on the middle right side
pencil/pencil_2,use for writing purpose
hammer/hammer_1,a claw hammer with a yellow and black handle
mouse/mouse_2,a black wired computer mouse
mouse/mouse_3,a black plugin computer mouse is displayed
water_bottle/water_bottle_3, blue
toothpaste/toothpaste_3,this is a tub of toothpaste with a blue label
stapler/stapler_1,this object is a mallet it has a wooden handle and a black rubber pounding head
picture_frame/picture_frame_4,it is a twosided black picture frame
spoon/spoon_4,it is a silver spoon
screwdriver/screwdriver_2,this is a screwdriver with a blue handle
coffee_mug/coffee_mug_5,this is a white mug with gold rim
lemon/lemon_5,this is an uncut
hammer/hammer_2,it is a black and yellow hammer
mouse/mouse_3,a black wired computer mouse
syringe/syringe_5,a syringe
bowl/bowl_1,green object that is beneficial to holinf liquids for eating
apple/apple_2,this is a green apple
cap/cap_1,this is a black and white cap with os on the front
syringe/syringe_2,an orange syringe
cell_phone/cell_phone_2,plastic object that fits in ones pocket used for soley communication
band_aid/band_aid_4,a blue box of bandaids
banana/banana_3,curved yellow fruit found hanging in tropical trees
toothpaste/toothpaste_3,a container of crest toothpaste lying horizontally
water_bottle/water_bottle_3,this is a bottle of vitamin water
potato/potato_3,this is a medium
gauze/gauze_1,na
bowl/bowl_2,a dark blue china bowl
pliers/pliers_3,a tool used to cut wire
potato/potato_2,this is a potato  it is oblong and brown
shampoo/shampoo_5,it is a blue bottle of argan oil shampoo
scissors/scissors_4,a orange pair of scissors
pencil/pencil_2,this is a purple mechanical pencil with a white eraser the tip is facing away
measuring_tape/measuring_tape_5,the object is an orange pepper
onion/onion_3,it is a purple onion  it has cracks in the outer shell
fork/fork_2, mostly chrome tape measure that has a bit of yellow on it
mouse/mouse_2,a black wired computer mouse
medicine_bottle/medicine_bottle_3,this is an over the counter pain reliever
apple/apple_4,this is an apple
can_opener/can_opener_2,this is a yellow can opener it has a yellow handle  turner
toothpaste/toothpaste_5,a white tube of toothpaste is displayed the colors green and red are on the label
mouse/mouse_1,a wired black computer mouse with usb connector
potato/potato_2,this is a large brown potato
band_aid/band_aid_3,the object is a blue box of gauze
bowl/bowl_3,red circular tool meant for the holding of food and liquids
onion/onion_5,a yellow onion
potato/potato_4,it is a brown potato
hammer/hammer_1,a yellow and black handled hammer
presciption_medicine_bottle/presciption_medicine_bottle_1, and white in the middle
lime/lime_3,a green lime
toothpaste/toothpaste_5,na
notebook/notebook_1,a red spiral notebook
syringe/syringe_5,it is a syringe with a  needle attached
food_jar/food_jar_2,the object is a jar of tomato sauce
water_bottle/water_bottle_5,this is a mini bottle of water
hand_towel/hand_towel_3,a kitchen drying towel
picture_frame/picture_frame_2,a triped standing photo frame
syringe/syringe_1,a syringe used for injecting medicines into livin and some non living objects
toothpaste/toothpaste_3,the object is a tube of toothpaste
water_bottle/water_bottle_1, silver
potato/potato_5,this is a potato it is orange and irregular in shape
hammer/hammer_5,this is a hammer which is used to pound things
coffee_mug/coffee_mug_4,this is an elaborately designed cup with blue
pliers/pliers_3,it is a pair of blue and red pliers
plate/plate_4,this is a green glass medium sized plate
bell_pepper/bell_pepper_2,a red pepper with sticker
lightbulb/lightbulb_1,a white led lightbulb
coffee_mug/coffee_mug_2,a black coffee mug with college name and logo
measuring_tape/measuring_tape_2,this is a silver retractable tape meausure
sponge/sponge_1,this is a sponge with a coarse scrubbing side and a soft spongy side
picture_frame/picture_frame_4,square black display object used for showing pictures
gauze/gauze_1,na
hammer/hammer_4,a linemans hammer with black and yellow handles
shampoo/shampoo_4,this is a bottle of shampoo
potato/potato_4,this is a potato is is brown in color and irregularly round
hammer/hammer_6,a rubber malat
book/book_4,a white and red hard cover book
fork/fork_3, shiny and spicy
lime/lime_3,a green lime
gauze/gauze_2,this is a box of gauze
food_can/food_can_1,need energy to enable growth and repair of tissues
measuring_tape/measuring_tape_3,pink and black hand held measuring tape
spoon/spoon_3,this is a silver soup spoon
pliers/pliers_2,theres a pair of pliers being displayed
lightbulb/lightbulb_4,a white lightbulb
band_aid/band_aid_1,the object is a bandaid brand container of bandages
food_can/food_can_3,it is a sealed can of chickpeas
food_jar/food_jar_3,this is a large glass jar of marinara sauce
stapler/stapler_3,this is a purple
onion/onion_5, uncut
banana/banana_3,this is a banana with a sticker on it
mouse/mouse_2,this is a wired black computer mouse it has gray trim
presciption_medicine_bottle/presciption_medicine_bottle_3,there is a small bottle of prescription medication
hammer/hammer_3,it is a pink and silver hammer
bell_pepper/bell_pepper_3,this is a green bell pepper  it is a vegetable that can be eaten raw or cooked
lemon/lemon_1,this is a lemon
coffee_mug/coffee_mug_1,here is a porcelain mug it is red on top and white on the bottom
soda_bottle/soda_bottle_4,plastic bottle holding carbonated sugar water for the devolepement of diabetes in humans
toothpaste/toothpaste_2,it is a box of colgate toothpaste
scissors/scissors_3,black medical scissors
toothbrush/toothbrush_4,this is a white toothbrush it is purple accented with blue bristles
marker/marker_6,this is a red sharpie
pencil/pencil_5,there is a can opener with black rubber on the handles and on the turn gear
fork/fork_5,this is a plastic fork
stapler/stapler_1,this is a pink stapler
fork/fork_1,this is a silver metal fork
allen_wrench/allen_wrench_4,this item is very small and is shaped in an l formation
potato/potato_4,a brown potato clean and in good condition
can_opener/can_opener_4,a black can opener
potato/potato_2,this is a big potato it has black spots on it
screwdriver/screwdriver_5,this is a small size screwdriver it is red and black
potato/potato_1,a brown russet potato
allen_wrench/allen_wrench_5,a set of allen wrenches
book/book_1,a paper back book with yellow and blue cover
book/book_4,a book used to read
shampoo/shampoo_5,this is a blue plastic bottle of argan oil
fork/fork_5,this is a white
marker/marker_3,this is a broad green marker
toothpaste/toothpaste_1,i think this is a box of ttothpaste
toothpaste/toothpaste_3,this is a tube of toothpaste it is white with a blue label
apple/apple_4,the object is a pair of pliers with black handles
gauze/gauze_1,na
lime/lime_2,there is a yellowish green lemon on the table
banana/banana_2,it is a bunch of five bananas
apple/apple_4,it is a red apple with a sticker
soda_bottle/soda_bottle_4,this object is a green bottle
hammer/hammer_5,this is a pink and black hammer
picture_frame/picture_frame_1,this object is a white picture frame
lime/lime_5,it is a typical lime
gauze/gauze_1,this is a roll of gauze
potato/potato_3,this is a red potato it is irregular in shape
food_can/food_can_4,this is the back of a standard sized can of navy beans the brand is goya and the label is dark blue
potato/potato_3,this is a small red potato
plate/plate_4,this is a large
scissors/scissors_1,these are a pair of kitchen shears that are black it has a red joint
picture_frame/picture_frame_1,this is a picture frame
mouse/mouse_1,this is a computer mouse
spoon/spoon_3,this is a tablespoon
food_can/food_can_1,yellow metal can that holds preserved foods
water_bottle/water_bottle_3,a plastic disposable water bottle
coffee_mug/coffee_mug_3,this is a simple
bowl/bowl_5,a square white bowl with gold trim
lightbulb/lightbulb_5,a small light bulb
screwdriver/screwdriver_4,on the table is a black and yellow screwdriver the base is black with a little yellow piece on the top before the long screw driver end
hand_towel/hand_towel_3,a fabric used to dry objects
syringe/syringe_1,a medical device that is used to inject fluid into
hammer/hammer_3,this is a pink hammer
banana/banana_5,this is a slightly brown banana
cap/cap_1,is is a black and white hat
picture_frame/picture_frame_2,a black fold out mirror set
can_opener/can_opener_3, writing instrument used to label on things that are resistant to light
book/book_4,a hardcover book
shampoo/shampoo_3,a regular size bottle of suaves 2 in 1 shampoo and conditioner for men the bottle is blue
food_jar/food_jar_5,this is a glass jar of olives
spoon/spoon_4,a silver table spoon
lemon/lemon_4,this object is a medium yellow lemon
food_jar/food_jar_1,this is a plastic jar of heinz home style peanut butter
band_aid/band_aid_2,a box of first aid bandages
notebook/notebook_1,a spiral bound notebook with a red cover
coffee_mug/coffee_mug_5,this is a white coffee cup
food_jar/food_jar_3,a jar of spaghetti sause
soda_bottle/soda_bottle_1,it is a full bottle of dr pepper
can_opener/can_opener_3,a hand operated bottle opener the handle and crank are turquoise in color
potato/potato_3,this object is a small red potato
pliers/pliers_1,the needle nose pliers are rather light weight with pink rubber handles they would be suitable for a smallish hand and a smallish task
pliers/pliers_5,this is a pair of pliers
band_aid/band_aid_2,it is a package of generic bandages
soda_bottle/soda_bottle_1,dr pepper plastic bottle
bowl/bowl_1,it is a light green bowl
picture_frame/picture_frame_1,a white picture frame
fork/fork_2,a metal dinner fork
onion/onion_4,it is a white onion
banana/banana_5,a yellow bananna
stapler/stapler_4,this is a grey and black stapler
plate/plate_4,this is a small white bottle of pain killer
plate/plate_4,this is a green plate it is made of porcelain
marker/marker_6, with at least two cloves on it
toothpaste/toothpaste_4,a tube with white
measuring_tape/measuring_tape_5,a silver and black measuring tape
apple/apple_1,it is a yellow apple
bowl/bowl_4,this is a small
allen_wrench/allen_wrench_4,this is a straw  it is made of plastic and you put it in a glass and suck the drink up through it
toothbrush/toothbrush_4,this is a packaged toothbrush
gauze/gauze_2,object 1 is a box of gauze pads
lemon/lemon_1,a small yellow lemon
bowl/bowl_5,the object is a bowl
cell_phone/cell_phone_1,this is a cellphone
measuring_tape/measuring_tape_4,a tool used for measuring long or short distances
potato/potato_1,a brown potato
marker/marker_5,a black sharpie the body is grey with a black cap
notebook/notebook_1,a red spiral notebook
apple/apple_4,a red apple
toothbrush/toothbrush_1,a yellow and white toothbrush
bell_pepper/bell_pepper_2,the object is a red bell pepper
shampoo/shampoo_3,a blue plastic bottle of shampoo
band_aid/band_aid_1,a red and white box of bandaids
apple/apple_5,i see a gala type of apple
bell_pepper/bell_pepper_5,the object is a yellow bell pepper
allen_wrench/allen_wrench_1,this is a set of allen wrenches
syringe/syringe_1,it is a mechanical pencil
lightbulb/lightbulb_4,the object is a white light bulb
measuring_tape/measuring_tape_3,it is a tape measure  it is black and pink in color
shampoo/shampoo_4,this is a green bottle of shampoo or body wash
soda_bottle/soda_bottle_1,this is a plastic bottle that contains a soft drink it has a red label
food_jar/food_jar_1,a jar of gravy with a red label
measuring_tape/measuring_tape_5,this is a metal measuring tape
hand_towel/hand_towel_3,a christmas themed white dish towel
lightbulb/lightbulb_5,a small lightbulb
cap/cap_1,this coffee mug bears a logo evocative of university athletics teams
soda_bottle/soda_bottle_5, pink kitchen sponge
book/book_3,this is a paperback book  i cannot tell the name of the book
screwdriver/screwdriver_2,a blue flat head screw driver
presciption_medicine_bottle/presciption_medicine_bottle_2,a small orange plastic prescription bottle with a white cap
gauze/gauze_2,this is a box laying on its back with the bottom facing forward the box is blue
scissors/scissors_5,a silver pair of scissors
pliers/pliers_4,pliers with a black and red handle
lime/lime_2,a yellow tinged green lime
stapler/stapler_2,the object is a black swingline stapler
syringe/syringe_1,plastic tool that holds ink meant for writing
toothbrush/toothbrush_3,refresh the teeth and mouth
soda_bottle/soda_bottle_5,a plastic bottle of soda
coffee_mug/coffee_mug_5,the object in this picture is a mug this object is typically used to drink beverages like tea or coffee
pliers/pliers_1,pink handled needle nose pliers
soda_bottle/soda_bottle_1,a bottle of soda with red label and white lid
stapler/stapler_2,it is a black stapler
presciption_medicine_bottle/presciption_medicine_bottle_1,this object is an orange pill case
coffee_mug/coffee_mug_2,a black and yellow coffee mug
pencil/pencil_3,a ball point pen
food_jar/food_jar_1,a glass jar of gravey
coffee_mug/coffee_mug_4,this is a mug with a floral design
band_aid/band_aid_4,a box of bandages
bell_pepper/bell_pepper_1,this is a red curvy pepper
toothbrush/toothbrush_1,a yellow and white toothbrush
stapler/stapler_2,this is a stapler  it inserts a small metal piece into papers and then seals it to attach the papers together  it can be removed as well
measuring_tape/measuring_tape_5,the object is a tape measure
measuring_tape/measuring_tape_1,a yellow and black measuring tape
water_bottle/water_bottle_4,the object is an unopened bottle of water
shampoo/shampoo_2,this is a bottle of mens shampoo it is red on top and white on the bottom
eye_glasses/eye_glasses_3,a tool used for humans to see
lemon/lemon_1,a yellow lemon
lime/lime_5,it is a lime
water_bottle/water_bottle_1,a dark blue metal water bottle with a flip top
tissue_box/tissue_box_1,a colorful box of tissues
lime/lime_2,a small green tomatoe
food_jar/food_jar_5,it is a sealed jar of olives
water_bottle/water_bottle_3,this is a clear water bottle with a blue logo
bell_pepper/bell_pepper_2,a red pepper
book/book_5,a hard covered book with white brown and green cover
mouse/mouse_1,on the turntable is a small
apple/apple_4,a red apple
scissors/scissors_2,this is a bright green dinner plate
food_can/food_can_3,this is a can of chick peas
banana/banana_5,a yellow banana with brown spots and a blue sticker
stapler/stapler_1,this is a pink stapler it has a white label across the top
lemon/lemon_4,in this image is a yellow lemon witch is a sour type of fruit
book/book_4,a white hardcover textbook titled algorithms
screwdriver/screwdriver_1,a black and orange handled regular screw driver
book/book_2,this object is a large hard cover book
screwdriver/screwdriver_1,a red and black flat head screw driver
screwdriver/screwdriver_4,i see a philips head screwdriver
bell_pepper/bell_pepper_2,this is red bell pepper
apple/apple_4,here is a red apple it has a stem and is dark in color
marker/marker_3, with a green stem
onion/onion_3,a red onion
lime/lime_1,this is a lime
notebook/notebook_1,this is a red spiral notebook with umrc on the front
medicine_bottle/medicine_bottle_1,half a bottle of day time flu medicine with an orange label and white lid
measuring_tape/measuring_tape_4,use for measuring the distance
cell_phone/cell_phone_2,a small silver cellphone
spoon/spoon_5,this is a plastic white spoon
screwdriver/screwdriver_2,a blue and yellow handled screwdriver
hammer/hammer_4,this is a hammer
food_can/food_can_1,a can of tomatoes with a yellow label
plate/plate_4,this is a grey towel it is soft  can be used to clean messes
potato/potato_3,a small red potato
toothbrush/toothbrush_5,this is a toothbrush in its original packaging
hammer/hammer_2,this is a small headed hammer with a black and yellow handle
shampoo/shampoo_3, medium sized hypodermic needle
coffee_mug/coffee_mug_3,white round tea cup with a handle
lime/lime_5,a green lime
picture_frame/picture_frame_2,insert the pictures
lime/lime_3,the object is a small green lime
toothbrush/toothbrush_2,a tool used to brush teeth
lime/lime_5,it is a small
shampoo/shampoo_4,bussiness etc
allen_wrench/allen_wrench_1,this is a small set of tools
food_can/food_can_5,the object is a can of corn it appears to be made of tin and hold about 8 ounces of corn
food_can/food_can_5,it is a beige can of food
allen_wrench/allen_wrench_1,a set of drill bits
measuring_tape/measuring_tape_1,a tape measure used to measure things
bowl/bowl_3,this is a small red bowl
potato/potato_5,this is a small sweet potato or a yam
banana/banana_3,use to drink tea or coffee
apple/apple_4,i see a red apple
picture_frame/picture_frame_2,a black 5x7 folding frame for 3 pitchers
fork/fork_2,this is a silver fork
scissors/scissors_1,the object is a pair of black scissors
shampoo/shampoo_2,this is a bottle of old spice volcano body wash
presciption_medicine_bottle/presciption_medicine_bottle_3,this is a prescription pill bottle  it holds a specific medicine that was prescribed by a medical professional for a specific person  it will also have instruction on it how to take the medicine
hammer/hammer_1,this is hammer with a yellow and black handle
medicine_bottle/medicine_bottle_4,this is a bottle of over the counter pills with a yellow label
stapler/stapler_1,serve a food
food_jar/food_jar_3,there is a can of tomato sauce  it is unopened and the sauce is red
medicine_bottle/medicine_bottle_5,this is a bottle of medicine with safety seal
plate/plate_2,a medium blue china plate
apple/apple_1,this is a yellow apple
hammer/hammer_1, black
screwdriver/screwdriver_5,this object is a screwdriver
lemon/lemon_2,a round yellow fruit that is sour
hammer/hammer_4,a double sided yellow and black hammer
marker/marker_2,a large black magic marker
bell_pepper/bell_pepper_3,this is a large bottle of dr pepper soda it is facing semisideways and appears to be nearly full
screwdriver/screwdriver_3, blue
bell_pepper/bell_pepper_3,a green pepper
water_bottle/water_bottle_1,a thermo container for water
screwdriver/screwdriver_3,a blue and yellow handled screwdriver
lemon/lemon_1,there is an orange on the turntable
scissors/scissors_1,it is a pair of black scissors
plate/plate_2, blue
toothpaste/toothpaste_1,this is a package of arm and hammer toothpaste
presciption_medicine_bottle/presciption_medicine_bottle_2,this is a standard size pill bottle for holding medications this is an orange medication bottle with a white lid and a pharmacy identity stick on it
can_opener/can_opener_5,it is a silver can opener
plate/plate_1,a paper plate with blue flowers
pencil/pencil_2,the object is a purple mechanical pencil
shampoo/shampoo_3,a tall blue bottle of soap
potato/potato_1,it is a brown potato
can_opener/can_opener_1,a green and white manually operated can opener
food_can/food_can_5,this can pops when you open it
cell_phone/cell_phone_2,an silver older model cell phone it has the rectangular shape of the old nokia phone
syringe/syringe_4,this is a clear syringe it is used to give shots to people  has a needle on the end
