water_bottle/water_bottle_4,on the turntable is a red
scissors/scissors_2,i see one pair of scissors
onion/onion_3,it is a red onion
lime/lime_3, green bell pepper
shampoo/shampoo_3,a blue bottle of mens soap
screwdriver/screwdriver_4,this is a screwdriver with a dark plastic handle and metal prong extending
lightbulb/lightbulb_3,it is a white floodlight
can_opener/can_opener_1,the object is a white can opener with a green handle
notebook/notebook_2,it is a black notebook with a black strap
cell_phone/cell_phone_3,a black cell phone with no cracks o the screen
bell_pepper/bell_pepper_2,it is  a red big pepper
banana/banana_3,this is a banana
spoon/spoon_2,the object is a large silver metal spoon
hammer/hammer_2,a black and yellow handled hammer
syringe/syringe_5,a syringle needle
book/book_5,the object is a book
lime/lime_1,this is a lime
screwdriver/screwdriver_4,a phillips screwdriver with a black and yellow handle
soda_bottle/soda_bottle_1,i see a bottle of dr pepper soda
screwdriver/screwdriver_5,object is a red and black tool with a flattened
book/book_2,a hardcover book
measuring_tape/measuring_tape_3,use to measure a distances
potato/potato_4,a small yellow potato
potato/potato_3,a red potato
hammer/hammer_1,this is a hammer with a yellow and black rubber grip handle the head of the hammer is facing the right and pointed away from me with the end of the handle closest to me
banana/banana_5,curved yellow fruit from a tropical tree monkeys find them yummy
screwdriver/screwdriver_5,this is a mini screwdriver with a large red and black handle
toothpaste/toothpaste_1,it is a package of arm and hammer complete care toothpaste
pencil/pencil_1,it is a blue and black mechanical pencil
fork/fork_3,this object is a silver fork
picture_frame/picture_frame_3,this is a black picture frame
shampoo/shampoo_5,the object is a plastic bottle
hammer/hammer_4,a yellow and black steel hammer
apple/apple_4,a red apple
hammer/hammer_5,this is a hammer with a black and pink handle  the handle is mostly black
lemon/lemon_5,the object is a lemon fruit
scissors/scissors_4,this is a mediumsized purple onion
book/book_2,a red hard cover book
sponge/sponge_1,this is a small sized sponge
toothpaste/toothpaste_3,a blue and white tube of toothpaste
eye_glasses/eye_glasses_2,on the table is a pair of brown glasses they do not have a large frame around the glasses
lightbulb/lightbulb_3,this is a light bulb for an overhead light it is white
syringe/syringe_2,this is a syringe to inject drugs
flashlight/flashlight_2,this is a portable item that is used to see in the dark  you use it to have light
screwdriver/screwdriver_4,a tool used to screw things in
gauze/gauze_1,na
syringe/syringe_3,a syringe needle
bowl/bowl_4,there is a empty blue bowl sitting on the table it looks very clean and does not seem to contain any content in it right now
pencil/pencil_2,the object is a writing tool
syringe/syringe_3,this is a syringe with a green bottom
coffee_mug/coffee_mug_2,it is a black and yellow mug
allen_wrench/allen_wrench_5,a yellow packaged set of allen wrenches
shampoo/shampoo_5,a blue bottle of argon oil shampoo
pliers/pliers_2,has blue and red handles with the long nose top
bell_pepper/bell_pepper_5,the object is a yellow bell pepper
book/book_2,it is a big book
lime/lime_4,this is a black sharpie and is used to write or highlight
food_can/food_can_3, to maintain body temperature
fork/fork_1,a silver fork
water_bottle/water_bottle_2,a bottle of water with a blue lid and a flower on the front
shampoo/shampoo_2,this is an aerosol can
lightbulb/lightbulb_2,this is a yellow onion with its skin slightly peeling
coffee_mug/coffee_mug_3, of undetermined purpose  one of the two parts looks very sharp
plate/plate_5,square flat object used for the displaying and holding of food
soda_bottle/soda_bottle_2,this is a plastic bottle of cocacola  it has a red label and red cap
screwdriver/screwdriver_4,this is a black handled screwdriver
lemon/lemon_1,a lemon
spoon/spoon_1,it is a wooden spoon
pencil/pencil_3,it is a clear and black mechanical pencil
scissors/scissors_4,this is an uncut
can_opener/can_opener_1,a white and green plastic object is displayed there is a green seemingly extendable piece on the left underside of the object
stapler/stapler_3,a blue stapler
eye_glasses/eye_glasses_4,this is a red sharpie permanent pen
spoon/spoon_1, ripe
spoon/spoon_5,this is a small
bell_pepper/bell_pepper_3,the object is a food
plate/plate_2,this is a large medium blue plate
bell_pepper/bell_pepper_1,a red bell pepper
bowl/bowl_3,the object is a red bowl
measuring_tape/measuring_tape_3,it is a small black and pink retractable tape measure
coffee_mug/coffee_mug_2, tin foil
flashlight/flashlight_2,a device used to emit light
mouse/mouse_3,this is a black wired mouse used in computers
presciption_medicine_bottle/presciption_medicine_bottle_3, simple fork
toothbrush/toothbrush_5,its used for clean oue teeth
toothbrush/toothbrush_5,an unopened package containing a colgate toothbrush
sponge/sponge_1,object is a charcoal colored phylum porifera used to scrub dirt or food off of things
can_opener/can_opener_4,this is a manual can opener
screwdriver/screwdriver_3,this is a metal screwdriver with a blue hand grip
eye_glasses/eye_glasses_3,there is a pair of blue glasses there  it has a fairly wide frame
fork/fork_2,this is a metal fork
apple/apple_4, in large red letters
eye_glasses/eye_glasses_4,these are wireframed glasses with rectangular lenses the ear hooks are brown and yellow tortoiseshell pattern
potato/potato_1,this is a side dish most people eat with steak
presciption_medicine_bottle/presciption_medicine_bottle_2,this is a bottle of prescription pills
banana/banana_1,this object is a yellow banana
hammer/hammer_6,this is a black mallet used like a hammer in the kitchen
book/book_5,it is a nondescript large book
mouse/mouse_1,a plug in computer mouse that is black in color
food_can/food_can_1,it is a can of cento peeled tomatoes
medicine_bottle/medicine_bottle_3,a small plastic bottle od asprin
eye_glasses/eye_glasses_4,a pair of reading glasses
notebook/notebook_2,this object is a little larger then hand size it is used to keep important information in one easy to find location
food_can/food_can_1,a small can of imported tomatoes
hand_towel/hand_towel_1,this is a folded yellow dish towel
allen_wrench/allen_wrench_5,a set of allen keys that could be found in any home improvement store
lightbulb/lightbulb_4,a light bulb
apple/apple_2,this is a fresh green apple  the stem is sticking out of the top
food_can/food_can_1,this is a grocery store can  it has a yellow label with red and black writing
screwdriver/screwdriver_1,red and black handtool used to tighten or loosen screws
bowl/bowl_5,this is a small white square shaped bowl with red trim
presciption_medicine_bottle/presciption_medicine_bottle_2,this is a prescription bottle
medicine_bottle/medicine_bottle_4,a bottle that holds medication
screwdriver/screwdriver_4,the item is a yellow and black phillips screwdriver
banana/banana_3,this is a single yellow banana with a sticker on it
shampoo/shampoo_4,wash your hair too too too too too
hammer/hammer_1,this is a small
hand_towel/hand_towel_3,this is a holiday themed small kitchen towel
banana/banana_2,a bunch of yellow bananas with light green stems
pliers/pliers_5,this item is a normal pair of pliers
presciption_medicine_bottle/presciption_medicine_bottle_3,it is an orange prescription bottle with a white label
shampoo/shampoo_3,the back of a bottle of shampoo or body wash
toothbrush/toothbrush_1,the object is a yellow toothbrush
sponge/sponge_1,a white and black sponge
potato/potato_3,this is a small
coffee_mug/coffee_mug_3, with white stripes
pencil/pencil_2,it is a blue mechanical pencil
lemon/lemon_4,this is a mediumsized whole lemon it is bright yellow in color
shampoo/shampoo_2,object 1 is a bottle of old spice body wash
lime/lime_3,it is a lime with a sticker
can_opener/can_opener_1,a white can opener with green accent
cap/cap_1,it is a black and white baseball hat with os printed in a rainbow font
cell_phone/cell_phone_3,a basic smart phone of the iphone or samsung variety
pencil/pencil_1,a clear and black plastic pen
picture_frame/picture_frame_4,the object is a picture frame it is black and appears to be made of plastic and glass
fork/fork_2,the object is a silver fork
allen_wrench/allen_wrench_5,a set of tools used to tighten or loosen alan screws
pliers/pliers_4,it is a pair of pliers with black handles
toothbrush/toothbrush_5,a packaged toothbush
presciption_medicine_bottle/presciption_medicine_bottle_2,this is a prescription pill bottle
toothpaste/toothpaste_3,the object is a tube of toothpaste
hammer/hammer_4,a black and yellow handled hammer
book/book_2,this object is hard and square it can be opened and pages can be flipped
screwdriver/screwdriver_5,this is a short screwdriver
plate/plate_5,a serving plate with a artistic swirl design on it
allen_wrench/allen_wrench_1, that is good for everyday use
fork/fork_5,it is a plastic white fork that looks like it has not been used before
book/book_3,this is a book
water_bottle/water_bottle_3,this is a smartwater bottle with water in it
eye_glasses/eye_glasses_3,the object is a pair of glasses with a blue frame
presciption_medicine_bottle/presciption_medicine_bottle_3,the object is a plastic pill bottle it is used to contain pills
water_bottle/water_bottle_5,a plastic of water
water_bottle/water_bottle_2,a tall cylinder containing water
potato/potato_3,in this image is a baby red potato
shampoo/shampoo_2,a bottle of old spice shampoo
apple/apple_3,on the table is a round red apple it is about the size of a soft ball
scissors/scissors_3,curved handtool used for the motion of easily cutting objects
spoon/spoon_2,there is a spoon on the turn table and looks very clean without any scratches or marks on it
lemon/lemon_1,a yellow lemon
lightbulb/lightbulb_5,a small light bulb
banana/banana_4,a ripe yellow banana
eye_glasses/eye_glasses_2, ground
fork/fork_4,a stainless steel dinner fork
cell_phone/cell_phone_3,this is a black smartphone
book/book_3,this is a textbook titled opencv 3 blueprints
band_aid/band_aid_5,this is a blue and white box of band aids
lime/lime_3,a lime
hammer/hammer_4,it is a yellow and black hammer
potato/potato_1,a unpelled potato
eye_glasses/eye_glasses_4,this object is placed upon ones face and held by the ears this item is fragile and if broke can make it difficult to do everyday tasks
screwdriver/screwdriver_3, red or yellow as this one is  it can be eaten raw or cooked in things like a pie
band_aid/band_aid_3,the object is a box of bandages
toothpaste/toothpaste_1,a box of toothpaste
spoon/spoon_4,a silver spoon
mouse/mouse_3,a black computer mouse
food_jar/food_jar_1,this is a jar of heinz turkey gravy
syringe/syringe_4,a small grey pen
flashlight/flashlight_3,it is a rectangular orange and black flashlight
bell_pepper/bell_pepper_2,it is a red bell pepper with a sticker
apple/apple_5,this is a yellow apple with some red stripes throughout
bowl/bowl_3,a red ceramic cereal bowl
lightbulb/lightbulb_1,this is an uncut
fork/fork_5,it is a white plastic fork
fork/fork_5,a white plastic fork
marker/marker_4,a large black magic marker
eye_glasses/eye_glasses_4,this is a pair of eyeglasses with a lightweight frame and dark earpieces
allen_wrench/allen_wrench_1, business
spoon/spoon_1,this is a wooden spoon this can be used when cooking to stir items together and keep food from burning or sticking to the bottom of the pan
picture_frame/picture_frame_3,it is the back of a black picture frame
medicine_bottle/medicine_bottle_3,a small white and red bottle of tylenol
potato/potato_3,this is a red potato  it is a vegetable frown under the ground  you can cook and eat them in a variety of ways as mashed
cap/cap_2,the object is a white baseball cap with breitling emblazened on its back
band_aid/band_aid_3, the body
syringe/syringe_3,it is a teal and clear syringe
bowl/bowl_5,a small white bowl with a colored rim
food_can/food_can_4,this is  a can of goya navy beans
screwdriver/screwdriver_2,a tool that tightens or loosens screws
banana/banana_1,a banana a fruit high in potassium enjoyed in many recipes for dessert or as a snack alone
marker/marker_3,a blue magic marker
banana/banana_4,this is a plastic spoon it can be used once an thrown away
screwdriver/screwdriver_2, shown from behind
marker/marker_5,a black permanent marker
allen_wrench/allen_wrench_5,this is a blue lead pencil
scissors/scissors_5,small metal scissors
coffee_mug/coffee_mug_3,it is a white bowl
coffee_mug/coffee_mug_4,a decorative tea cup
scissors/scissors_5,object 2 is a pair of scissors they look like medical scissors
band_aid/band_aid_5,this is a box of bandaids
toothpaste/toothpaste_1,a box with toothpaste
spoon/spoon_2,this is a silver spoon that is very shiny
food_jar/food_jar_4,a jar of sliced pickles
spoon/spoon_5,a white plastic spoon
presciption_medicine_bottle/presciption_medicine_bottle_2,it is a syringe with a needle attached
soda_bottle/soda_bottle_1,object 5 is a bottle of dr pepper soda
syringe/syringe_2,it is an orange syringe
hand_towel/hand_towel_1,this is a yellow and white woven dish towel that has been folded in half
pliers/pliers_4,it is a granny smith apple
food_jar/food_jar_4,the object is a jar of pickles the brand mascot is a stork and the jar has a blue lid
scissors/scissors_6,the object is a pair of scissors with blue and grey handles
cap/cap_1,it is a black and white baltimore orioles cap with a rainbow os logo
shampoo/shampoo_4,the object is a clear green bottle of shampoo
syringe/syringe_3,there is a syringe sitting on the turntable
flashlight/flashlight_2,a small black flaslight with handle
apple/apple_2,it is a lemon with a sticker
pliers/pliers_1,this is a pair of pliers or tweezers
book/book_1,this is a paperback book the title is the craft of research
flashlight/flashlight_1,this is a flashlight
toothbrush/toothbrush_2,this is an adult toothbrush that is pink
can_opener/can_opener_3,a blue handled can opener
water_bottle/water_bottle_4,this is a small disposable bottle of drinkng water
spoon/spoon_2,this is a silver spoon
coffee_mug/coffee_mug_1,this is a ceramic cup
bowl/bowl_4, though the name of the drug is not show only the directionswarnings
lime/lime_4,a green lime
gauze/gauze_2,this is a box of gauze pads purchased at a drug store or department store the gauze pads can be used to dress wounds and soak up blood
allen_wrench/allen_wrench_4,the object is a small metal screwdriver
screwdriver/screwdriver_1,a screwdriver
scissors/scissors_2,a scissors with blue and white handles
spoon/spoon_1,this is a large wooden cooking spoon
onion/onion_2, with one or more striking surfaces
banana/banana_5,this is a yellow banana it is straight instead of curved
plate/plate_4,this is a green plate  the diameter of the plate is about 12 inches at the top
screwdriver/screwdriver_4,this is a phillips head screw driver it has a yellow handle with a black grip
food_can/food_can_1,this object is a large can of tomatoes with a mostly yellow label
pliers/pliers_1,a pair of pink pliers
pliers/pliers_1,this is a red erasable marker
pencil/pencil_5,it is a yellow and green mechanical pencil
presciption_medicine_bottle/presciption_medicine_bottle_3,it is a bottle of pills
hammer/hammer_1,this is a black and yellow hammer
scissors/scissors_4,this is a large pair of scissors with an orange handle
food_jar/food_jar_2,this is a round
presciption_medicine_bottle/presciption_medicine_bottle_1,it is an orange prescription bottle with a white label
hand_towel/hand_towel_2,it is a measuring tape that is in a metal container with a yellow button to lock or unlock the measuring tape
onion/onion_3,here is a purple onion it has transluscent white skin
allen_wrench/allen_wrench_2,this is an allen wrench it is silver
cap/cap_1,this is a box of generic band aids
lemon/lemon_1, usually made of metal
medicine_bottle/medicine_bottle_1,a bottle of dayquil
lightbulb/lightbulb_3,this is a flood light
lime/lime_5,this is a green ripe lime b
picture_frame/picture_frame_1,this is the back of a white picture frame
flashlight/flashlight_2,this is a small black flashlight with a black leash
bowl/bowl_5,a bowl used to hold food that is being ate at a meal
soda_bottle/soda_bottle_4,a green bottle of soda
onion/onion_2,a brown onion
syringe/syringe_1,this is a syringe it is very thin
measuring_tape/measuring_tape_1,a yellow and black tape measure
fork/fork_3,this is a silver fork
spoon/spoon_4,this is a teaspoon
cap/cap_1,the object is a black and white ball cap
stapler/stapler_2,the object is a black swingline stapler
onion/onion_3,a red onion
allen_wrench/allen_wrench_5,a set of allen wrenches
can_opener/can_opener_5,this is a smartphone
soda_bottle/soda_bottle_2,this is a personalized bottle of coke
book/book_3,a black and orange book
scissors/scissors_4,the object is red with a green spot it is shiny and round
pliers/pliers_3,it is a pair of pliers
potato/potato_3,this is a red potato
pencil/pencil_3,this is a black mechanical pencil with a red clip
bowl/bowl_5,it is a rectangular white bowl with a red trim
bowl/bowl_1,this is a green soup bowl
soda_bottle/soda_bottle_5,it is a bottle of diet coke
mouse/mouse_2,the object is a usb corded black mouse
shampoo/shampoo_1,bottle of head and shoulders shampoo
marker/marker_4,this is a tube with a black top and what appears to contain grayish material
coffee_mug/coffee_mug_2,this is a mug it is black and has a yellow logo
allen_wrench/allen_wrench_2,on the table is a silver metal tool it is an l shape
water_bottle/water_bottle_1,a dark blue metal water bottle with a flip top
spoon/spoon_3,the object is a metal spoon the spoon is clean
onion/onion_5,this item is small and gold in color
pencil/pencil_3,this mechanical pencils eraser appears to be slightly used
book/book_5,a textbook with a light
cell_phone/cell_phone_3,it is a black iphone
mouse/mouse_1,this is a computer mouse
cell_phone/cell_phone_3,this is a cell phone
banana/banana_3, which can make your eyes water
hand_towel/hand_towel_2,a gray bath towel
pliers/pliers_2, blue and white it is a tube with a cap on it
pencil/pencil_4,a black ball point pen
scissors/scissors_2,the object in this picture is a pair of scissors this object is typically used for cutting a variety of materials such as paper or cloth
shampoo/shampoo_5,a blue bottle of argan of morocco shampoo with a gold top
toothbrush/toothbrush_3,a tooth brush with with a blue brush head and green body
spoon/spoon_5,it is a plastic spoon
soda_bottle/soda_bottle_1,this is a large 16 oz bottle of dr pepper
bowl/bowl_1,the object is a green bowl
plate/plate_4,this is a plate it holds food
water_bottle/water_bottle_2,on the turntable is an unopened bottle of fiji brand water the bottle is transparent with a blue top and a pink flower printed on it
hand_towel/hand_towel_2,a gray bath towel
toothbrush/toothbrush_2,a tool used to brush teeth
plate/plate_2,this is a blue salad plate
fork/fork_3,this object is a silver fork
pliers/pliers_4,pliers with a red and black handle
cap/cap_2,the object is a white hat
pill_cutter/pill_cutter_1,this is an unopened package of a colgate toothbrush this toothbrush has a blue handle
pliers/pliers_2,a tool used to bend objects
lightbulb/lightbulb_1,this is an led light bulb
measuring_tape/measuring_tape_4,the object is a small black keychain it appears to be made of plastic with a metal key ring
flashlight/flashlight_2,a small black flashlight with a wrist strap and red onoff button
water_bottle/water_bottle_3,a clear plastic bottle of water sits upright with the front label facing to the left
bowl/bowl_1,on the table is a green bowl it is shiny and smooth with two stripes on the top and middle
pliers/pliers_5,there is a pair of pliers with blue and red grips
toothpaste/toothpaste_3,object is a writing tool with an erasable ink
hammer/hammer_3,this is a red and white plastic bottle
bowl/bowl_2,a blue ceramic bowl
shampoo/shampoo_1,i see a bottle of head  shoulders 2 in 1 shampoo and conditioner
band_aid/band_aid_4,a blue and white box of bandaids
lightbulb/lightbulb_3, abstract pattern on the cover
toothbrush/toothbrush_2,this is a pink toothbrush
hand_towel/hand_towel_1,the object is a yellow towel
hammer/hammer_1, cream etc
lime/lime_1,a green lime
hammer/hammer_6,a wooden handled mallet
scissors/scissors_6,this is a blue pair of scissors
pliers/pliers_1,this is a pair of pink pliers pliers are used to clamp objects together or hold something steady
stapler/stapler_2,this image is of a stapler witch is used for keeping multiple papers held together
toothpaste/toothpaste_3,a tube of toothpaste
picture_frame/picture_frame_3,the object is a picture frame the picture frame is black
pencil/pencil_4,the object is a black ballpoint retractable pen
plate/plate_1,it is a white paper plate with a blue flower design
allen_wrench/allen_wrench_3,it is a black allen wrench
presciption_medicine_bottle/presciption_medicine_bottle_1,this is a prescription bottle
syringe/syringe_3,a syringe
food_jar/food_jar_4,this looks like a modest size mallet great for small projects around your home
toothpaste/toothpaste_5,this is a large tube of colgate toothpaste
soda_bottle/soda_bottle_4,a green transparent bottle of soda
picture_frame/picture_frame_4,two standing black adjoining picture frames
water_bottle/water_bottle_4, small
water_bottle/water_bottle_2,here is a water bottle with a pink flower on it and a blue design
lightbulb/lightbulb_3,the object is a white light bulb
picture_frame/picture_frame_3, blue water bottle sitting on the turntable
soda_bottle/soda_bottle_5,this is a plastic bottle of cocacola  the label is red
pencil/pencil_1,this is a writing pen
lemon/lemon_2,a lemon that has not been cut
apple/apple_2,a pair of glasses
fork/fork_1,a silver fork
book/book_5,this is a book called multiagent systems
flashlight/flashlight_3,this object is a flashlight when turned on it will illuminate an area
lime/lime_2,it is a light green lime
allen_wrench/allen_wrench_4,this is a jam busting tool for clogged disposals
banana/banana_1,on the table is a pair of dark blue glasses the frames have a dark blue color around the glass
pliers/pliers_3,this is a pair of pliers
water_bottle/water_bottle_3,a bottle of smart water
marker/marker_3,the object is a blue dry erase marker
plate/plate_1,is is a white plate with a blue flower design
stapler/stapler_3,this is a staple gun
hand_towel/hand_towel_3,a folded white kitchen towel with christmas print on it
hammer/hammer_4,a yellow and black hammer
toothbrush/toothbrush_4,the object is a blue toothbrush
hammer/hammer_6,a black rubber malet
lime/lime_4,a green lime
lightbulb/lightbulb_5,its a shower device that water can spray out of
book/book_3,this is a paperback book with title opencv 3 blueprints
fork/fork_2,the object is a metal fork
syringe/syringe_2,an orange syringe
medicine_bottle/medicine_bottle_5,it is a sealed bottle of what appears to be cough medicine
potato/potato_3,a red potato
bell_pepper/bell_pepper_4,this is an orange bell pepper
shampoo/shampoo_1,a white and blue bottle of body wash
screwdriver/screwdriver_2,this is a screwdriver with a blue handle
pencil/pencil_2,this is a screwdriver it is used to put screws into things
eye_glasses/eye_glasses_1,it is a pair of black framed glasses
allen_wrench/allen_wrench_1,it is a set of hex keys with a red holder
food_can/food_can_4,a tin can of soup
onion/onion_4,a white onion
notebook/notebook_2,use for writing purpose
plate/plate_5,this is a 2 liter bottle of coke
pliers/pliers_3,small handtool used for the pinching
water_bottle/water_bottle_5,i see a water bottle
bowl/bowl_1,this is a small green bowl
banana/banana_2,this is a bunch of bananas with dark spots
marker/marker_1,this is a red sharpie
screwdriver/screwdriver_1,this is a screwdriver with a red and black handle
band_aid/band_aid_4,a box of bandages
toothpaste/toothpaste_3,protection that helps fight cavities
syringe/syringe_5,this is a syringe needle
banana/banana_1,a yellow fruit that grows in bunches
toothpaste/toothpaste_3,object 3 is a tube of crest toothpaste
plate/plate_5,there is a plate with sensors on it
hammer/hammer_1,a black and yellow hammer
allen_wrench/allen_wrench_1,a set of drill bits
notebook/notebook_1,a spiral bound notebook with a red cover
fork/fork_2,a silver fork
spoon/spoon_1,this is a spatula
measuring_tape/measuring_tape_1,a yellow measuring tape
marker/marker_3,this is a marker it is white with a green cap
shampoo/shampoo_2,a plastic container of a personal toiletry
screwdriver/screwdriver_3,this is a screwdriver with a blue handle
lightbulb/lightbulb_1,this is a light bulb it is oddly shaped
spoon/spoon_1,large wooden tool used for cooking
picture_frame/picture_frame_2,a black three photo picture frame
bell_pepper/bell_pepper_1,an elegant teacup with flower designs
cap/cap_2,a white baseball cap
bowl/bowl_4,in this image is a single blue bowl used for eating food out of
measuring_tape/measuring_tape_1,yellow hand held measuring tape
mouse/mouse_1,the object is a black corded usb mouse
book/book_5,this is a large hardcover book
spoon/spoon_2,this is a spoon it is silver
lightbulb/lightbulb_5,this object is a white led light bulb
lemon/lemon_5, bandaid
banana/banana_4, plastic spoon
fork/fork_1,this is a silver fork it is shiny  has 4 ends on it
picture_frame/picture_frame_1,this is a white picture fram with no picture inside of it
book/book_3, blue on the right
marker/marker_4,it is a thick black sharpie
hand_towel/hand_towel_1,there is a folded yellow and white dish cloth with a plaid pattern on it
marker/marker_6,it is a red sharpie
banana/banana_4,a yellow banana with a couple bruises and marks on it
can_opener/can_opener_4,this is a manual can opener with black handles
potato/potato_1,the object is a baking potato
sponge/sponge_1,this is a wodden spoon
